id,artist,field_name,text,date,institution
IT85,29,,"Hung Liu’s artistic training began in the Socialist Realist style of painting in the People's Republic of China, attending the Beijing Teachers’ College and Central Academy of Fine Arts in Beijing. In 1984, she sought a way out of Mao Zedong’s communist regime and continued her artistic pursuits in the U.S. After studying with historian Moira Roth and artist Allan Kaprow at the University of California, San Diego (1984-86), Liu cultivated a conceptual approach that interrogated the complexities of history, political revolution, and displacement through painting-centered, multimedia works. She fostered deep connections to the San Francisco Bay Area arts community during her extensive years of teaching at Mills College (1990-2014) in Oakland, California. In 2022, the National Portrait Gallery held Liu’s posthumous retrospective exhibition, showcasing an extensive collection of her portraits that honored individuals overlooked amid social upheaval and largely forgotten by history, drawing on personal, historical, and archival sources.",2026,2
IT86,29,wikidata_id,"Hung Liu (劉虹) (17 February 1948 – 7 August 2021) was a Chinese-born American contemporary artist. She was predominantly a painter, but also worked with mixed-media and site-specific installation and was also one of the first artists from China to establish a career in the United States.

A ten-year retrospective of Liu's work traveled nationally in the U.S. in 1998 and 1999. Summoning Ghosts: The Art of Hung Liu was a retrospective collection of Liu's work with paintings from more than 40 collections displayed.",2026,1
IT87,28,ArtistBio,"American, born 1972",2026,0
IT88,28,Gender,female,2026,0
IT89,28,wikidata_id,"Patty Chang (born February 3, 1972, in San Leandro, California) is an American performance artist and film director living and working in Los Angeles, California. Originally trained as a painter, Chang received her Bachelor of Arts at the University of California, San Diego. It wasn't until she moved to New York that she became involved with performance art.

She has staged solo shows nationally and internationally, including at Jack Tilton Gallery, New York (1999), Museo National de Reina Sofia, Madrid (2000), the Hammer Museum, Los Angeles, Museum of Contemporary Art, Chicago, and the New Museum, New York (all 2005), Flotsam Jetsam with longtime collaborator David Kelley at the Museum of Modern Art, New York (2014), the Queens Museum (2017-18), the Museum of Fine Arts in Boston (2020), and Pioneer Works in Brooklyn (2021).
",2026,1
IT90,27,,"Tom Nakashima is an artist and educator whose paintings, prints, collages, and sculptures address concerns of war and ecological destruction. Juxtaposing motifs from European, American, and Japanese art, Nakashima developed a body of heavily allegorical works that reflect the complexities of his religious upbringing, biracial identity, and concerns for nuclear proliferation.

Nakashima was born in Seattle’s Japantown in 1941, shortly before his father, a secondgeneration Japanese American, was drafted as a surgeon for the US Army Medical Corps. When Executive Order 9066 was issued the following year, his family was stationed at Camp Chaffee, Arkansas, and exempted from forced removal, unlike many of their relatives who were incarcerated at Minidoka and Tule Lake War Relocation Centers in Jerome, Idaho, and Modoc County, California, respectively. Nakashima eventually grew up in Dubuque, Iowa, raised as a Roman Catholic by his mother of German, Irish, and Jewish ancestry.

Nakashima’s aspirations of becoming an artist took shape during summer visits to New Hope, Pennsylvania, where his uncle, the architect, woodworker, and designer George Nakashima, settled after the war. There, Nakashima became familiar with the art of his uncle’s contemporaries, such as Harry Bertoia, Morris Graves, Isamu Noguchi, and Ben Shahn. After serving in the 101st Airborne Division of the US Army (1960-63), Nakashima pursued his academic training at Loras College in Dubuque, Iowa (1963-67), and the University of Notre Dame in Indiana (1967-69). Early in his career, Nakashima made large-scale abstract paintings, counting Barnett Newman as his most significant influence.

By the early 1980s, Nakashima became increasingly engaged with his Japanese heritage and experimented with a more representational style. Beginning with the series Standing on Ground Zero (1982–85), he developed a visual vocabulary referred to Giotto’s architectural structures, Matisse’s nude figures, and Jasper Johns’s targets, alongside images of cages, suspended fish, Buddhist and Hindu iconography. His compositions often incorporated or were painted onto three-dimensional structures, such as wooden boxes and Japanese folding screens. His nuanced reflection on the contradictory nature of sanctuaries, as both protective and confining, emerged as a prominent theme in his practice.

Since 1999, Nakashima pivoted to portraying piles of destroyed orchard trees, abandoned farm structures, and their debris as remnants of housing development projects that he encountered and photographed in Virginia. For the Treepile series, Nakashima further emphasizes his use of the grid system that allows him to work on expansive surfaces of collaged paper, canvas, or wood panels through small square portions. The resulting complex but forlorn imagery of entangled branches alludes to our artificial order imposed onto nature, as seen in bonsai and vanitas paintings, which expands his consideration for sanctuaries in environmental and ecological terms.

Based in the Mid-Atlantic region since the 1970s, Nakashima has exhibited both locally and internationally. His works became widely known especially after his participation in the pivotal exhibition The Decade Show: Frameworks of Identity in the 1980s, organized between three institutions in New York City, the Museum of Contemporary Hispanic Art, the New Museum of Contemporary Art, and the Studio Museum in Harlem, in 1990. In addition to his prolific artistic practice, Nakashima held an extensive teaching career at the Columbus College of Art & Design, Columbus, Ohio (1969-73), West Virginia University, Morgantown, West Virginia (1973-81), the Catholic University of America, Washington, DC (1981–2002) and Augusta University, Augusta, Georgia (2002–10).",2026,2
IT91,25,,"Born in Washington. Painter of Japanese descent who has been a diligent arts educator most of his life.

Nora Panzer, ed. Celebrate America in Poetry and Art (New York and Washington, D.C.: Hyperion Paperbacks for Children in association with the National Museum of American Art, Smithsonian Institution, 1994)


More Information
Artist Biography
Roger Shimomura, a third-generation Japanese American, creates paintings and performance pieces blending an ironic mixture of Japanese imagery and American popular culture. A native of Seattle, he and his family were removed to an internment camp for Japanese Americans during World War II. Over the past decade, much of Shimomura's work has been devoted to exploring the emotional and psychological hardships of the internment experience, based on the diaries of his grandmother. More recently, however, he has taken a more lighthearted approach to the serious themes of xenophobia, racism, and cross-cultural interface.

Jacquelyn Days Serwer, with contributions by Jonathan P. Binstock, Andrew Connors, Gwendolyn H. Everett, and Lynda Roscoe Hartigan American Kaleidoscope: Themes and Perspectives in Recent Art (Washington, D.C.: National Museum of American Art, 1996

Luce Artist Biography
Roger Shimomura was born three years before President Roosevelt's executive order mandated the internment of 120,000 Japanese Americans during World War II. When the family was released, they lived for a time in South Chicago, but returned to Seattle in 1945, settling in Nihonmachi, a district of Japanese American residents (Roger Shimomura: Return of the Yellow Peril, exhibition catalogue, Cheney Cowles Museum, 1993). The artist attended the University of Washington and earned a graduate degree from Syracuse University. Shimomura's paintings, which combine American pop culture images with Japanese woodblock prints, are inspired by his own experiences of racism and by the diaries that his grandmother kept over a period of fifty-six years. He began teaching at Kansas University in 1969, where he was legendarily tough on his students. Shimomura retired in 2004 after thirty-five years in Lawrence.",2026,2
IT92,25,,"Also known as
Roger Yutaka Shimomura
Born
Seattle, Washington, United States
Active in
Lawrence, Kansas, United States",2026,2
IT93,25,ulan_url,"American installation artist, born 1939",2026,3
IT94,25,wikidata_id,"Roger Shimomura (born Roger Yutaka Shimomura in 1939 in Seattle) is an American artist and a retired professor at the University of Kansas, having taught there from 1969 to 2004. His art, showcased across the United States, Japan, Canada, Mexico, and Israel, often combines American popular culture, traditional Asian tropes, and stereotypical racial imagery to provoke thought and debate on issues of identity and social perception.",2026,1
IT95,25,,"American, born 1939",2026,5
